question,entity
Can you tell me the latest news?,Can you tell me the latest news?
What are the news headlines today?,What are the news headlines today?
What's the news on technology?,technology
Any news about the stock market?,stock market
What's happening in the entertainment world?,entertainment
Tell me the latest political news.,political
Any updates on the sports world?,sports
Tell me the latest business news.,business
Any updates on the fashion world?,fashion
Tell me the latest health and wellness news.,health and wellness
Any updates on the science and technology world?,science and technology
Tell me the latest environmental news.,environmental
Any updates on the automotive world?,automotive
Tell me the latest technology news.,technology
Any updates on the entertainment world?,entertainment
Tell me the latest finance and economy news.,finance and economy
Any updates on the medical world?,medical
Tell me the latest fashion and beauty news.,fashion and beauty
Any updates on the gaming world?,gaming
Tell me the latest travel and leisure news.,travel and leisure
Any updates on the food and restaurant world?,food and restaurant
Tell me the latest education and learning news.,education and learning
Any updates on the music world?,music
Tell me the latest technology and gadgets news.,technology and gadgets
Any updates on the celebrity world?,celebrity
Tell me the latest arts and culture news.,arts and culture
Any updates on the education and technology world?,education and technology
Tell me the latest fashion and lifestyle news.,fashion and lifestyle
Any updates on the technology and gaming world?,technology and gaming
